CODIGO,DISTRITO,DEPARTAMENTO,MUNICIPIO,ESTABLECIMIENTO,DIRECCION,TELEFONO,SUPERVISOR,DIRECTOR,NIVEL,SECTOR,AREA,STATUS,MODALIDAD,JORNADA,PLAN,DEPARTAMENTAL
22-01-2083-43,22-002,JUTIAPA,JUTIAPA,EORM,CASERIO NARANJO II CANTON LAGUNILLA,,CARLOS HUMBERTO CRUZ ALAY,,PRIMARIA,OFICIAL,RURAL,CERRADA DEFINITIVAMENTE,MONOLINGUE,MATUTINA,DIARIO(REGULAR),JUTIAPA
22-01-2089-45,22-01-1228,JUTIAPA,JUTIAPA,INEB,ALDEA LOS ANONOS CANTON VALENCIA,42185903,JULIO CÉSAR RIZO GARCÍA,BRENDA LORENA CORADO ARIAS,BASICO,OFICIAL,RURAL,ABIERTA,MONOLINGUE,MATUTINA,DIARIO(REGULAR),JUTIAPA
22-01-2095-43,24-016,JUTIAPA,JUTIAPA,EORM,CASERIO LOS COCOS CANTON LAGUNILLA,,CAROLINA DEL ROSARIO VALENZUELA (ISE PREDIN),,PRIMARIA,OFICIAL,RURAL,CERRADA DEFINITIVAMENTE,MONOLINGUE,MATUTINA,DIARIO(REGULAR),JUTIAPA
22-01-2096-43,22-002,JUTIAPA,JUTIAPA,EORM,CASERIO LA VEGUITA CANTON POTRERO GRANDE,,CARLOS HUMBERTO CRUZ ALAY,,PRIMARIA,OFICIAL,RURAL,CERRADA DEFINITIVAMENTE,MONOLINGUE,MATUTINA,DIARIO(REGULAR),JUTIAPA
22-01-2097-43,22-002,JUTIAPA,JUTIAPA,EORM,CASERIO EL SILENCIO CANTON PIPILTEPEQUE,,CARLOS HUMBERTO CRUZ ALAY,,PRIMARIA,OFICIAL,RURAL,CERRADA DEFINITIVAMENTE,MONOLINGUE,MATUTINA,DIARIO(REGULAR),JUTIAPA
22-01-2104-42,24-016,JUTIAPA,JUTIAPA,EDAC -PRONADE- ANEXA,"CASERIO RIO GRANDE, CANTON SAN ANTONIO",,CAROLINA DEL ROSARIO VALENZUELA (ISE PREDIN),,PARVULOS,OFICIAL,RURAL,CERRADA DEFINITIVAMENTE,MONOLINGUE,MATUTINA,DIARIO(REGULAR),JUTIAPA
22-01-2105-42,24-016,JUTIAPA,JUTIAPA,EDAC -PRONADE- ANEXA,"CASERIO CALLEJON DEL RIO, ALDEA AMAYO INGENIO",,CAROLINA DEL ROSARIO VALENZUELA (ISE PREDIN),,PARVULOS,OFICIAL,RURAL,CERRADA DEFINITIVAMENTE,MONOLINGUE,MATUTINA,DIARIO(REGULAR),JUTIAPA
22-01-2106-42,26-022,JUTIAPA,JUTIAPA,EDAC -PRONADE- ANEXA,CASERIO EL RODEO CANTON TUNAS,,PROYECTO PREDIN,,PARVULOS,OFICIAL,RURAL,CERRADA DEFINITIVAMENTE,MONOLINGUE,MATUTINA,DIARIO(REGULAR),JUTIAPA
22-01-2107-42,26-022,JUTIAPA,JUTIAPA,EDAC -PRONADE-,"CASERIO BUENAS VISTAS, CANTON VALENCIA",,PROYECTO PREDIN,,PARVULOS,OFICIAL,RURAL,CERRADA DEFINITIVAMENTE,MONOLINGUE,MATUTINA,DIARIO(REGULAR),JUTIAPA
22-01-2108-42,24-016,JUTIAPA,JUTIAPA,EDAC -PRONADE-,"CASERIO LOS HOYOS, CANTON SAN MARCOS",,CAROLINA DEL ROSARIO VALENZUELA (ISE PREDIN),,PARVULOS,OFICIAL,RURAL,CERRADA DEFINITIVAMENTE,MONOLINGUE,MATUTINA,DIARIO(REGULAR),JUTIAPA
22-01-2113-45,22-004,JUTIAPA,JUTIAPA,INSTITUTO PARTICULAR MIXTO DE EDUCACION BASICA 'EDEN',ALDEA EL TABLON CANTON SAN ANTONIO,,MARA ALEIDA QUIÑONEZ Y QUIÑONEZ,,BASICO,PRIVADO,RURAL,CERRADA TEMPORALMENTE,MONOLINGUE,VESPERTINA,DIARIO(REGULAR),JUTIAPA
22-01-2117-43,22-005,JUTIAPA,JUTIAPA,EORM,CASERIO PEÑA BLANCA CANTON VALENCIA ALDEA EL DURAZNO,,EDGAR ARNULFO GONZALEZ GUDIEL,,PRIMARIA,OFICIAL,RURAL,CERRADA DEFINITIVAMENTE,MONOLINGUE,MATUTINA,DIARIO(REGULAR),JUTIAPA
22-01-2123-43,22-008,JUTIAPA,JUTIAPA,EORM,CASERIO TIERRA BLANCA ALDEA HUERTAS,,EMMANUEL MONZON HERRERA,,PRIMARIA,OFICIAL,RURAL,CERRADA DEFINITIVAMENTE,MONOLINGUE,MATUTINA,DIARIO(REGULAR),JUTIAPA
22-01-2129-43,22-002,JUTIAPA,JUTIAPA,EORM,CANTON SAN JOSE CASERIO LA CEIBITA,,CARLOS HUMBERTO CRUZ ALAY,,PRIMARIA,OFICIAL,RURAL,CERRADA DEFINITIVAMENTE,MONOLINGUE,MATUTINA,DIARIO(REGULAR),JUTIAPA
22-01-2131-45,22-01-1225,JUTIAPA,JUTIAPA,COLEGIO PARTICULAR MIXTO DE MAGISTERIO,1A. AVENIDA 4-64 ZONA 1,78442157,CECILIA ISABEL ALDECOA CASASOLA,ISRAEL JOSUÉ VÁSQUEZ,BASICO,PRIVADO,URBANA,ABIERTA,MONOLINGUE,MATUTINA,DIARIO(REGULAR),JUTIAPA
22-01-2132-45,,JUTIAPA,JUTIAPA,ESCUELA REGIONAL DE HOTELERIA Y TURISMO ECOLOGICO,CALLE 15 DE SEPTIEMBRE 5-09 ZONA 1,"8441160, 8441331",,,BASICO,PRIVADO,URBANA,CERRADA DEFINITIVAMENTE,MONOLINGUE,MATUTINA,DIARIO(REGULAR),JUTIAPA
22-01-2133-46,,JUTIAPA,JUTIAPA,ESCUELA REGIONAL DE HOTELERIA Y TURISMO ECOLOGICO,CALLE 15 DE SEPTIEMBRE 5-09 ZONA 1,"8441160, 8441331",,,DIVERSIFICADO,PRIVADO,URBANA,CERRADA DEFINITIVAMENTE,MONOLINGUE,MATUTINA,DIARIO(REGULAR),JUTIAPA
22-01-2134-46,,JUTIAPA,JUTIAPA,ESCUELA REGIONAL DE HOTELERIA Y TURISMO ECOLOGICO,CALLE 15 DE SEPTIEMBRE 5-09 ZONA 1,"8441160, 8441331",,,DIVERSIFICADO,PRIVADO,URBANA,CERRADA DEFINITIVAMENTE,MONOLINGUE,VESPERTINA,DIARIO(REGULAR),JUTIAPA
22-01-2135-42,26-043,JUTIAPA,JUTIAPA,EDAC PRONADE ANEXA,CASERIO PEÑA BLANCA,,PROYECTO COMADEP,,PARVULOS,OFICIAL,RURAL,CERRADA DEFINITIVAMENTE,MONOLINGUE,MATUTINA,DIARIO(REGULAR),JUTIAPA
22-01-2136-43,26-022,JUTIAPA,JUTIAPA,EDAC PRONADE,CASERIO PEÑA BLANCA,,PROYECTO PREDIN,,PRIMARIA,OFICIAL,RURAL,CERRADA DEFINITIVAMENTE,MONOLINGUE,MATUTINA,DIARIO(REGULAR),JUTIAPA
22-01-2137-42,26-022,JUTIAPA,JUTIAPA,EDAC PRONADE ANEXA,CASERIO VILLA HERMOSA CANTON POTRERO GRANDE,,PROYECTO PREDIN,,PARVULOS,OFICIAL,RURAL,CERRADA DEFINITIVAMENTE,MONOLINGUE,MATUTINA,DIARIO(REGULAR),JUTIAPA
22-01-2138-43,26-022,JUTIAPA,JUTIAPA,EDAC PRONADE,CASERIO VILLA HERMOSA CANTON POTRERO GRANDE,,PROYECTO PREDIN,,PRIMARIA,OFICIAL,RURAL,CERRADA DEFINITIVAMENTE,MONOLINGUE,MATUTINA,DIARIO(REGULAR),JUTIAPA
22-01-2139-42,26-043,JUTIAPA,JUTIAPA,EDAC PRONADE ANEXA,SECTOR II ALDEA EL NARANJO CANTON LAGUNILLA,,PROYECTO COMADEP,,PARVULOS,OFICIAL,RURAL,CERRADA DEFINITIVAMENTE,MONOLINGUE,MATUTINA,DIARIO(REGULAR),JUTIAPA
22-01-2140-43,26-022,JUTIAPA,JUTIAPA,EDAC PRONADE,SECTOR II ALDEA EL NARANJO CANTON LAGUNILLA,,PROYECTO PREDIN,,PRIMARIA,OFICIAL,RURAL,CERRADA DEFINITIVAMENTE,MONOLINGUE,MATUTINA,DIARIO(REGULAR),JUTIAPA
22-01-2141-42,26-043,JUTIAPA,JUTIAPA,EDAC PRONADE ANEXA,CASERIO LA CEIBITA CANTON SAN JOSE BUENA VISTA,,PROYECTO COMADEP,,PARVULOS,OFICIAL,RURAL,CERRADA DEFINITIVAMENTE,MONOLINGUE,MATUTINA,DIARIO(REGULAR),JUTIAPA
22-01-2142-43,26-022,JUTIAPA,JUTIAPA,EDAC PRONADE,CASERIO LA CEIBITA CANTON SAN JOSE BUENA VISTA,,PROYECTO PREDIN,,PRIMARIA,OFICIAL,RURAL,CERRADA DEFINITIVAMENTE,MONOLINGUE,MATUTINA,DIARIO(REGULAR),JUTIAPA
22-01-2143-42,26-043,JUTIAPA,JUTIAPA,EDAC PRONADE ANEXA,CASERIO EL SILENCIO CANTON PIPILTEPEQUE,,PROYECTO COMADEP,,PARVULOS,OFICIAL,RURAL,CERRADA DEFINITIVAMENTE,MONOLINGUE,MATUTINA,DIARIO(REGULAR),JUTIAPA
22-01-2144-43,26-022,JUTIAPA,JUTIAPA,EDAC PRONADE,CASERIO EL SILENCIO CANTON PIPILTEPEQUE,,PROYECTO PREDIN,,PRIMARIA,OFICIAL,RURAL,CERRADA DEFINITIVAMENTE,MONOLINGUE,MATUTINA,DIARIO(REGULAR),JUTIAPA
22-01-2145-42,26-043,JUTIAPA,JUTIAPA,EDAC PRONADE ANEXA,CASERIO VEGUITAS CANTON POTRERO GRANDE,,PROYECTO COMADEP,,PARVULOS,OFICIAL,RURAL,CERRADA DEFINITIVAMENTE,MONOLINGUE,MATUTINA,DIARIO(REGULAR),JUTIAPA
22-01-2146-43,26-022,JUTIAPA,JUTIAPA,EDAC PRONADE,CASERIO VEGUITAS CANTON POTRERO GRANDE,,PROYECTO PREDIN,,PRIMARIA,OFICIAL,RURAL,CERRADA DEFINITIVAMENTE,MONOLINGUE,MATUTINA,DIARIO(REGULAR),JUTIAPA
22-01-2147-43,26-022,JUTIAPA,JUTIAPA,EDAC PRONADE,CASERILLO SALITRILLO CANTON TUNAS,,PROYECTO PREDIN,,PRIMARIA,OFICIAL,RURAL,CERRADA DEFINITIVAMENTE,MONOLINGUE,MATUTINA,DIARIO(REGULAR),JUTIAPA
22-01-2148-43,26-022,JUTIAPA,JUTIAPA,EDAC PRONADE,CASERIO LAS LAJAS CANTON PIPILTEPEQUE,,PROYECTO PREDIN,,PRIMARIA,OFICIAL,RURAL,CERRADA DEFINITIVAMENTE,MONOLINGUE,MATUTINA,DIARIO(REGULAR),JUTIAPA
22-01-2156-43,26-022,JUTIAPA,JUTIAPA,EDAC PRONADE,CASERIO LOS MANANTIALES CANTON VALENCIA,,PROYECTO PREDIN,,PRIMARIA,OFICIAL,RURAL,CERRADA DEFINITIVAMENTE,MONOLINGUE,MATUTINA,DIARIO(REGULAR),JUTIAPA
22-01-2165-42,26-022,JUTIAPA,JUTIAPA,EDAC -PRONADE- ANEXA,CASERIO NANCES DULCES CANTON EL PEÑON,,PROYECTO PREDIN,,PARVULOS,OFICIAL,RURAL,CERRADA DEFINITIVAMENTE,MONOLINGUE,MATUTINA,DIARIO(REGULAR),JUTIAPA
22-01-2166-42,22-01-1225,JUTIAPA,JUTIAPA,EODP ANEXA A EORM,CASERIO LA CUESTA CANTON TUNAS,56304055,CECILIA ISABEL ALDECOA CASASOLA,NOE ERUBEY MÉNDEZ NAVARRO,PARVULOS,OFICIAL,RURAL,ABIERTA,MONOLINGUE,MATUTINA,DIARIO(REGULAR),JUTIAPA
22-01-2167-42,22-005,JUTIAPA,JUTIAPA,EODP ANEXA A EORM,CANTON LAS TUNAS CASERIO ARRAYANAS,,EDGAR ARNULFO GONZALEZ GUDIEL,,PARVULOS,OFICIAL,RURAL,CERRADA DEFINITIVAMENTE,MONOLINGUE,MATUTINA,DIARIO(REGULAR),JUTIAPA
22-01-2168-45,22-004,JUTIAPA,JUTIAPA,COLEGIO PARTICULAR MIXTO DAVENPORT-CIDETRA,ALDEA TUNAS,78520297,MARA ALEIDA QUIÑONEZ Y QUIÑONEZ,,BASICO,PRIVADO,RURAL,CERRADA TEMPORALMENTE,MONOLINGUE,DOBLE,FIN DE SEMANA,JUTIAPA
22-01-2170-45,22-004,JUTIAPA,JUTIAPA,COLEGIO PARTICULAR MIXTO DAVENPORT-CIDETRA,ALDEA LAS TUNAS,78520297,MARA ALEIDA QUIÑONEZ Y QUIÑONEZ,,BASICO,PRIVADO,RURAL,CERRADA TEMPORALMENTE,MONOLINGUE,VESPERTINA,DIARIO(REGULAR),JUTIAPA
22-01-2190-42,22-005,JUTIAPA,JUTIAPA,EODP ANEXA A EORM,CASERIO LA PERLA CANTON MARIAS MONTAQAS,,EDGAR ARNULFO GONZALEZ GUDIEL,,PARVULOS,OFICIAL,RURAL,CERRADA DEFINITIVAMENTE,MONOLINGUE,MATUTINA,DIARIO(REGULAR),JUTIAPA
22-01-2196-46,22-001,JUTIAPA,JUTIAPA,INSTITUTO TECNICO PARTICULAR DE DIVERSIFICADO INTECPADI,5TA. CALLE 5-43 ZONA 1,78442296,CECILIA ISABEL ALDECOA CASASOLA DE CASTRO,RONI ERNESTO RECINOS ESTRADA,DIVERSIFICADO,PRIVADO,URBANA,ABIERTA,MONOLINGUE,DOBLE,DIARIO(REGULAR),JUTIAPA
22-01-2217-43,26-022,JUTIAPA,JUTIAPA,EDAC -PRONADE-,CASERIO CIELITO LINDO ALDEA CERRO GORDO,,PROYECTO PREDIN,,PRIMARIA,OFICIAL,RURAL,CERRADA DEFINITIVAMENTE,MONOLINGUE,MATUTINA,DIARIO(REGULAR),JUTIAPA
22-01-2218-43,26-022,JUTIAPA,JUTIAPA,EDAC -PRONADE-,CANTON VALENCIA,,PROYECTO PREDIN,,PRIMARIA,OFICIAL,RURAL,CERRADA DEFINITIVAMENTE,MONOLINGUE,MATUTINA,DIARIO(REGULAR),JUTIAPA
22-01-2219-43,26-022,JUTIAPA,JUTIAPA,EDAC -PRONADE-,CASERIO HIERBA BUENA CANTON POTRERO GRANDE,,PROYECTO PREDIN,,PRIMARIA,OFICIAL,RURAL,CERRADA DEFINITIVAMENTE,MONOLINGUE,MATUTINA,DIARIO(REGULAR),JUTIAPA
22-01-2220-43,26-022,JUTIAPA,JUTIAPA,EDAC -PRONADE-,CASERIO SAN PABLO CANTON SAN JOSE BUENA VISTA,,PROYECTO PREDIN,,PRIMARIA,OFICIAL,RURAL,CERRADA DEFINITIVAMENTE,MONOLINGUE,MATUTINA,DIARIO(REGULAR),JUTIAPA
22-01-2221-43,26-022,JUTIAPA,JUTIAPA,EDAC -PRONADE-,CASERIO TIERRA BLANCA CANTON ENCINO GACHO,,PROYECTO PREDIN,,PRIMARIA,OFICIAL,RURAL,CERRADA DEFINITIVAMENTE,MONOLINGUE,MATUTINA,DIARIO(REGULAR),JUTIAPA
22-01-2225-42,26-043,JUTIAPA,JUTIAPA,EDAC -PRONADE- ANEXA,CASERIO EL SILENCIO CANTON LOMITAS,,PROYECTO COMADEP,,PARVULOS,OFICIAL,RURAL,CERRADA DEFINITIVAMENTE,MONOLINGUE,MATUTINA,DIARIO(REGULAR),JUTIAPA
22-01-2226-42,26-022,JUTIAPA,JUTIAPA,EDAC -PRONADE- ANEXA,CASERIO LAS LAJAS CANTON PIPILTEPEQUE,,PROYECTO PREDIN,,PARVULOS,OFICIAL,RURAL,CERRADA DEFINITIVAMENTE,MONOLINGUE,MATUTINA,DIARIO(REGULAR),JUTIAPA
22-01-2227-42,26-043,JUTIAPA,JUTIAPA,EDAC -PRONADE- ANEXA,CASERIO CIELITO LINDO ALDEA CERRO GORDO,,PROYECTO COMADEP,,PARVULOS,OFICIAL,RURAL,CERRADA DEFINITIVAMENTE,MONOLINGUE,MATUTINA,DIARIO(REGULAR),JUTIAPA
22-01-2228-42,26-022,JUTIAPA,JUTIAPA,EDAC -PRONADE- ANEXA,CANTON VALENCIA,,PROYECTO PREDIN,,PARVULOS,OFICIAL,RURAL,CERRADA DEFINITIVAMENTE,MONOLINGUE,MATUTINA,DIARIO(REGULAR),JUTIAPA
22-01-2229-42,26-022,JUTIAPA,JUTIAPA,EDAC -PRONADE- ANEXA,CASERIO TIERRA BLANCA CANTON ENCINO GACHO,,PROYECTO PREDIN,,PARVULOS,OFICIAL,RURAL,CERRADA DEFINITIVAMENTE,MONOLINGUE,MATUTINA,DIARIO(REGULAR),JUTIAPA
22-01-2230-42,26-022,JUTIAPA,JUTIAPA,EDAC -PRONADE- ANEXA,CASERIO LA PERLA CANTON MARIAS MONTAQAS,,PROYECTO PREDIN,,PARVULOS,OFICIAL,RURAL,CERRADA DEFINITIVAMENTE,MONOLINGUE,MATUTINA,DIARIO(REGULAR),JUTIAPA
22-01-2233-43,26-022,JUTIAPA,JUTIAPA,EDAC -PRONADE-,CASERIO CIELO AZUL CANTON AMAYO INGENIO,,PROYECTO PREDIN,,PRIMARIA,OFICIAL,RURAL,CERRADA DEFINITIVAMENTE,MONOLINGUE,MATUTINA,DIARIO(REGULAR),JUTIAPA
22-01-2234-43,26-022,JUTIAPA,JUTIAPA,EDAC -PRONADE-,CASERIO LA PERLA CANTON MARIAS MONTAQAS,,PROYECTO PREDIN,,PRIMARIA,OFICIAL,RURAL,CERRADA DEFINITIVAMENTE,MONOLINGUE,MATUTINA,DIARIO(REGULAR),JUTIAPA
22-01-2240-42,22-01-1223,JUTIAPA,JUTIAPA,EODP ANEXA A EORM  DR. JOSE MIGUEL MEDRANO SAGASTUME,CANTON AMAYO SITIO,,EDGAR ARNULFO GONZÁLEZ GUDIEL,MARISELA ELIZABETH ALVEÑO RAMÍREZ,PARVULOS,OFICIAL,RURAL,ABIERTA,MONOLINGUE,MATUTINA,DIARIO(REGULAR),JUTIAPA
22-01-2241-42,22-01-1223,JUTIAPA,JUTIAPA,EODP ANEXA A EORM,CANTON AMAYO INGENIO,53535103,EDGAR ARNULFO GONZÁLEZ GUDIEL,ZOILA DEL ROSARIO GARCÍA HERNÁNDEZ,PARVULOS,OFICIAL,RURAL,ABIERTA,MONOLINGUE,MATUTINA,DIARIO(REGULAR),JUTIAPA
22-01-2242-43,22-01-1218,JUTIAPA,JUTIAPA,COLEGIO  EL BOSQUE,ALDEA EL CHILTEPE,78446103,EMMANUEL MONZÓN HERRERA,MONICA VANESSA SANDOVAL MONTESFLORES,PRIMARIA,PRIVADO,RURAL,ABIERTA,MONOLINGUE,MATUTINA,DIARIO(REGULAR),JUTIAPA
22-01-2243-45,22-01-1221,JUTIAPA,JUTIAPA,INSTITUTO PARTICULAR MIXTO NOCTURNO  EBEN-EZER,"7A. CALLE Y 8A. AVENIDA 7-49 ZONA 3, BARRIO EL CHAPARON",56931065,SHAROL VANESA PÉREZ VEGA DE SOTO,CÉSAR GEOVANNI RAMOS RAMÍREZ,BASICO,PRIVADO,URBANA,ABIERTA,MONOLINGUE,NOCTURNA,DIARIO(REGULAR),JUTIAPA
22-01-2244-45,22-01-1226,JUTIAPA,JUTIAPA,INEB DE TELESECUNDARIA,"ALDEA LA ARADA, CANTON SAN MARCOS",32322221,REMBERTO RECINOS SARCEÑO,JESSICA XIOMARA LÉMUS SARCEÑO,BASICO,OFICIAL,RURAL,ABIERTA,MONOLINGUE,MATUTINA,DIARIO(REGULAR),JUTIAPA
22-01-2245-45,22-01-1223,JUTIAPA,JUTIAPA,INEB DE TELESECUNDARIA,CANTON EL PEÑON,41884429,EDGAR ARNULFO GONZÁLEZ GUDIEL,ROBERTO CARLOS ALARCÓN HERNÁNDEZ,BASICO,OFICIAL,RURAL,ABIERTA,MONOLINGUE,VESPERTINA,DIARIO(REGULAR),JUTIAPA
22-01-2246-42,22-01-1218,JUTIAPA,JUTIAPA,COLEGIO  EL BOSQUE,ALDEA EL CHILTEPE,78446103,EMMANUEL MONZÓN HERRERA,MONICA VANESSA SANDOVAL MONTESFLORES,PARVULOS,PRIVADO,RURAL,ABIERTA,MONOLINGUE,MATUTINA,DIARIO(REGULAR),JUTIAPA
22-01-2247-45,22-01-1227,JUTIAPA,JUTIAPA,INEB DE TELESECUNDARIA,CANTON POTRERO GRANDE,,CARLOS HUMBERTO CRUZ ALAY,BRENDA MARLENI RODAS GÓMEZ,BASICO,OFICIAL,RURAL,ABIERTA,MONOLINGUE,VESPERTINA,DIARIO(REGULAR),JUTIAPA
22-01-2248-45,22-01-1220,JUTIAPA,JUTIAPA,INEB DE TELESECUNDARIA,CANTON ENCINO GACHO,53636639,RONY ESTUARDO SANDOVAL MEDINA,ABEL  PÉREZ CHACÓN,BASICO,OFICIAL,RURAL,ABIERTA,MONOLINGUE,VESPERTINA,DIARIO(REGULAR),JUTIAPA
22-01-2286-43,,JUTIAPA,JUTIAPA,EORM,CASERIO EL MARILLO CANTON LAGUNILLA,,,,PRIMARIA,OFICIAL,RURAL,CERRADA DEFINITIVAMENTE,MONOLINGUE,VESPERTINA,DIARIO(REGULAR),JUTIAPA
22-01-2295-42,26-023,JUTIAPA,JUTIAPA,EDAC -PRONADE- ANEXA,CASERIO LAS JOYAS CANTON VALENCIA,,PROYECTO PREDIN,,PARVULOS,OFICIAL,RURAL,CERRADA DEFINITIVAMENTE,MONOLINGUE,MATUTINA,DIARIO(REGULAR),JUTIAPA
22-01-2296-42,26-023,JUTIAPA,JUTIAPA,EDAC -PRONADE- ANEXA,CASERIO HIERBABUENA CANTON POTRERO GRANDE,,PROYECTO PREDIN,,PARVULOS,OFICIAL,RURAL,CERRADA DEFINITIVAMENTE,MONOLINGUE,MATUTINA,DIARIO(REGULAR),JUTIAPA
22-01-2297-42,26-022,JUTIAPA,JUTIAPA,EDAC -PRONADE- ANEXA,CASERIO SAN PABLO CANTON SAN JOSE BUENA VISTA,,PROYECTO PREDIN,,PARVULOS,OFICIAL,RURAL,CERRADA DEFINITIVAMENTE,MONOLINGUE,MATUTINA,DIARIO(REGULAR),JUTIAPA
22-01-2303-45,22-007,JUTIAPA,JUTIAPA,ESCUELA EN CIENCIAS DE LA COMUNICACION ECCO,KM. 116.5,78440223,CARLOS OBDULIO OROZCO REYES,,BASICO,PRIVADO,URBANA,CERRADA TEMPORALMENTE,MONOLINGUE,DOBLE,FIN DE SEMANA,JUTIAPA
22-01-2304-45,22-003,JUTIAPA,JUTIAPA,ESCUELA EN CIENCIAS DE LA COMUNICACION ECCO,KM. 116.5,78440223,REMBERTO RECINOS SARCEÑO,RODABEL RIOS,BASICO,PRIVADO,URBANA,CERRADA TEMPORALMENTE,MONOLINGUE,DOBLE,FIN DE SEMANA,JUTIAPA
22-01-2310-42,22-01-1223,JUTIAPA,JUTIAPA,EODP ANEXA A EORM,CASERIO LOS COMUNES CANTON EL PEÑON,31712433,EDGAR ARNULFO GONZÁLEZ GUDIEL,ARACELY ADALY BARRERA OCHOA,PARVULOS,OFICIAL,RURAL,ABIERTA,MONOLINGUE,MATUTINA,DIARIO(REGULAR),JUTIAPA
22-01-2311-45,22-01-1218,JUTIAPA,JUTIAPA,COLEGIO PARTICULAR MIXTO  EL BOSQUE,ALDEA EL CHILTEPE,78442277,EMMANUEL MONZÓN HERRERA,INGRID CAROL JUAREZ DOMINGUEZ,BASICO,PRIVADO,RURAL,ABIERTA,MONOLINGUE,MATUTINA,DIARIO(REGULAR),JUTIAPA
22-01-2312-45,22-01-1219,JUTIAPA,JUTIAPA,INEB TELESECUNDARIA,ALDEA NUEVA ESPERANZA,42214266,MARCO TULIO CASTILLO MELGAR,MARITZA JUDITH RIVERA GUZMÁN,BASICO,OFICIAL,RURAL,ABIERTA,MONOLINGUE,MATUTINA,DIARIO(REGULAR),JUTIAPA
22-01-2313-45,22-01-1218,JUTIAPA,JUTIAPA,INEB TELESECUNDARIA,ALDEA IXTACAPA,32269051,EMMANUEL MONZÓN HERRERA,JAVIER  ALARCÓN HERNÁNDEZ,BASICO,OFICIAL,RURAL,ABIERTA,MONOLINGUE,VESPERTINA,DIARIO(REGULAR),JUTIAPA
22-01-2314-45,22-002,JUTIAPA,JUTIAPA,NUCLEO FAMILIAR EDUCATIVO PARA EL DESARROLLO NUFED NO. 304,ALDEA LAS TUNAS I,59455083,CARLOS HUMBERTO CRUZ ALAY,.,BASICO,OFICIAL,RURAL,ABIERTA,MONOLINGUE,VESPERTINA,DIARIO(REGULAR),JUTIAPA
22-01-2315-45,22-01-1227,JUTIAPA,JUTIAPA,INEB TELESECUNDARIA,ALDEA ANIMAS LOMAS,45153061,CARLOS HUMBERTO CRUZ ALAY,JORGE MARIO PEÑATE GUERRA,BASICO,OFICIAL,RURAL,ABIERTA,MONOLINGUE,MATUTINA,DIARIO(REGULAR),JUTIAPA
22-01-2316-45,22-007,JUTIAPA,JUTIAPA,COLEGIO PARTICULAR MIXTO 'NUEVA GENERACION',CALLE DE LA UNIVERCIDAD COLONIA DEMOCRACIA III ZONA 2,59244868,CARLOS OBDULIO OROZCO REYES,,BASICO,PRIVADO,URBANA,CERRADA TEMPORALMENTE,MONOLINGUE,MATUTINA,DIARIO(REGULAR),JUTIAPA
22-01-2335-45,22-01-1228,JUTIAPA,JUTIAPA,INEB DE TELESECUNDARIA,CANTON VALENCIA,45189441,JULIO CÉSAR RIZO GARCÍA,NANCY DALILA GIRÓN RAMÍREZ,BASICO,OFICIAL,RURAL,ABIERTA,MONOLINGUE,VESPERTINA,DIARIO(REGULAR),JUTIAPA
22-01-2336-45,22-01-1223,JUTIAPA,JUTIAPA,INEB TELESECUNDARIA,ALDEA EL AGUACATE CANTON AMAYO SITIO,51121762,EDGAR ARNULFO GONZÁLEZ GUDIEL,REYNA PATRICIA MÉNDEZ RODRÍGUEZ,BASICO,OFICIAL,RURAL,ABIERTA,MONOLINGUE,VESPERTINA,DIARIO(REGULAR),JUTIAPA
22-01-2343-42,22-01-1218,JUTIAPA,JUTIAPA,EODP ANEXA A EORM,CANTON LAGUNILLA,51203536,EMMANUEL MONZÓN HERRERA,MIRZA ALEJANDRA PEÑATE CARRILLO,PARVULOS,OFICIAL,RURAL,ABIERTA,MONOLINGUE,MATUTINA,DIARIO(REGULAR),JUTIAPA
22-01-2344-42,22-01-1225,JUTIAPA,JUTIAPA,EODP ANEXA A EORM,ALDEA RIO DE LA VIRGEN,42902422,CECILIA ISABEL ALDECOA CASASOLA,ALDINA ESPERANZA ESTRADA GARCÍA,PARVULOS,OFICIAL,RURAL,ABIERTA,MONOLINGUE,MATUTINA,DIARIO(REGULAR),JUTIAPA
22-01-2345-42,22-01-1225,JUTIAPA,JUTIAPA,EODP ANEXA A EORM,ALDEA CERRO COLORADO,56252792,CECILIA ISABEL ALDECOA CASASOLA,OLGA MARINA GONZÁLEZ SARCEÑO,PARVULOS,OFICIAL,RURAL,ABIERTA,MONOLINGUE,MATUTINA,DIARIO(REGULAR),JUTIAPA
22-01-2347-42,22-01-1219,JUTIAPA,JUTIAPA,EODP ANEXA A EORM,ALDEA TRANCAS I,55768650,MARCO TULIO CASTILLO MELGAR,DORIS ELIZABETH MARTÍNEZ RAMIREZ,PARVULOS,OFICIAL,RURAL,ABIERTA,MONOLINGUE,MATUTINA,DIARIO(REGULAR),JUTIAPA
22-01-2348-42,22-01-1219,JUTIAPA,JUTIAPA,EODP ANEXA A EORM,CANTON NUEVA ESPERANZA,,MARCO TULIO CASTILLO MELGAR,WENDY MARLENY SALGUERO ORELLANA,PARVULOS,OFICIAL,RURAL,ABIERTA,MONOLINGUE,MATUTINA,DIARIO(REGULAR),JUTIAPA
22-01-2349-42,22-01-1225,JUTIAPA,JUTIAPA,EODP ANEXA A EORM,"ALDEA EL TABLON, CANTON SAN ANTONIO",58074391,CECILIA ISABEL ALDECOA CASASOLA,ERIKA YESSENIA JACINTO JUÁREZ,PARVULOS,OFICIAL,RURAL,ABIERTA,MONOLINGUE,MATUTINA,DIARIO(REGULAR),JUTIAPA
22-01-2350-42,22-003,JUTIAPA,JUTIAPA,EODP ANEXA EORM,CASERIO LOS COMUNES,,REMBERTO RECINOS SARCEÑO,,PARVULOS,OFICIAL,RURAL,CERRADA TEMPORALMENTE,MONOLINGUE,MATUTINA,DIARIO(REGULAR),JUTIAPA
22-01-2414-42,22-005,JUTIAPA,JUTIAPA,EODP ANEXA A EORM,CANTON POTRERO GRANDE,,EDGAR ARNULFO GONZALEZ GUDIEL,,PARVULOS,OFICIAL,RURAL,CERRADA TEMPORALMENTE,MONOLINGUE,MATUTINA,DIARIO(REGULAR),JUTIAPA
22-01-2415-42,22-01-1223,JUTIAPA,JUTIAPA,EODP ANEXA A EORM,CANTON AMAYO INGENIO CASERIO SITIO VIEJO,47607805,EDGAR ARNULFO GONZÁLEZ GUDIEL,JENIFER MELISSA PEÑATE VIRULA,PARVULOS,OFICIAL,RURAL,ABIERTA,MONOLINGUE,MATUTINA,DIARIO(REGULAR),JUTIAPA
22-01-2416-42,22-01-1223,JUTIAPA,JUTIAPA,EODP ANEXA A EORM,ALDEA EL AGUACATE CANTON AMAYO SITIO,45128461,EDGAR ARNULFO GONZÁLEZ GUDIEL,JOSÉ SAMUEL GONZÁLEZ GUZMÁN,PARVULOS,OFICIAL,RURAL,ABIERTA,MONOLINGUE,MATUTINA,DIARIO(REGULAR),JUTIAPA
22-01-2417-42,22-01-1220,JUTIAPA,JUTIAPA,EODP ANEXA A EORM,CANTON ENCINO GACHO,59799359,RONY ESTUARDO SANDOVAL MEDINA,SINDY MARÍA SALGUERO UCELO,PARVULOS,OFICIAL,RURAL,ABIERTA,MONOLINGUE,MATUTINA,DIARIO(REGULAR),JUTIAPA
22-01-2421-42,22-01-1228,JUTIAPA,JUTIAPA,EODP ANEXA A EORM,"CASERIO LA BREA, CANTON MARIAS MONTAÑAS",,JULIO CÉSAR RIZO GARCÍA,MARIA ARGENTINA CARRILLO PALMA,PARVULOS,OFICIAL,RURAL,ABIERTA,MONOLINGUE,MATUTINA,DIARIO(REGULAR),JUTIAPA
22-01-2422-42,22-01-1227,JUTIAPA,JUTIAPA,EODP ANEXA A EORM,ALDEA QUEBRADA SECA,58882662,CARLOS HUMBERTO CRUZ ALAY,FLOR DE MARÍA GARCÍA PÉREZ,PARVULOS,OFICIAL,RURAL,ABIERTA,MONOLINGUE,MATUTINA,DIARIO(REGULAR),JUTIAPA
22-01-2431-46,22-01-1221,JUTIAPA,JUTIAPA,COLEGIO PARTICULAR MIXTO  EBEN EZER,ENTRADA AL COMPLEJO EDUCATIVO 0-16 ZONA 3,56931065,SHAROL VANESA PÉREZ VEGA DE SOTO,CÉSAR GEOVANNI RAMOS RAMÍREZ,DIVERSIFICADO,PRIVADO,URBANA,ABIERTA,MONOLINGUE,NOCTURNA,DIARIO(REGULAR),JUTIAPA
22-01-2436-45,22-01-1218,JUTIAPA,JUTIAPA,LICEO BETHEL,ALDEA EL JICARO,50476099,EMMANUEL MONZÓN HERRERA,JANNER ELÍ LOPEZ LOPEZ,BASICO,PRIVADO,RURAL,ABIERTA,MONOLINGUE,MATUTINA,DIARIO(REGULAR),JUTIAPA
22-01-2444-46,22-004,JUTIAPA,JUTIAPA,COLEGIO PARTICULAR MIXTO DAVENPORT CIDETRA,ALDEA LAS TUNAS,78520297,MARA ALEIDA QUIÑONEZ Y QUIÑONEZ,,DIVERSIFICADO,PRIVADO,RURAL,CERRADA TEMPORALMENTE,MONOLINGUE,DOBLE,FIN DE SEMANA,JUTIAPA
22-01-2448-45,22-037,JUTIAPA,JUTIAPA,COLEGIO PARTICULAR MIXTO  GENESIS,7A. CALLE Y 8A. AVENIDA 7-49 ZONA 3 BARRIO EL CHAPARRON,30008172,SANDRA NINNETH BONILLA ARCHILA,MANUEL LISANDRO LÓPEZ SALGUERO,BASICO,PRIVADO,URBANA,ABIERTA,MONOLINGUE,MATUTINA,DIARIO(REGULAR),JUTIAPA
22-01-2468-42,22-01-1227,JUTIAPA,JUTIAPA,EODP ANEXA A EORM,CASERIO LA MINA CANTON TUNAS,,CARLOS HUMBERTO CRUZ ALAY,GLENDA MARISOL LÓPEZ GÓMEZ,PARVULOS,OFICIAL,RURAL,ABIERTA,MONOLINGUE,MATUTINA,DIARIO(REGULAR),JUTIAPA
22-01-2471-42,22-037,JUTIAPA,JUTIAPA,COLEGIO PARTICULAR MIXTO  GENESIS,7A. CALLE Y 8A. AVENIDA 7-49 ZONA 3 BARRIO EL CHAPARRON,52906524,SANDRA NINNETH BONILLA ARCHILA,SANDRA DAMIRA LÓPEZ RAMÍREZ,PARVULOS,PRIVADO,URBANA,ABIERTA,MONOLINGUE,MATUTINA,DIARIO(REGULAR),JUTIAPA
22-01-2472-42,22-01-1219,JUTIAPA,JUTIAPA,EODP ANEXA A EORM,CANTON SAN JOSE BUENA VISTA ALDEA EL COHETERO,42188268,MARCO TULIO CASTILLO MELGAR,FABIOLA ARLETH CRUZ AGUILAR,PARVULOS,OFICIAL,RURAL,ABIERTA,MONOLINGUE,MATUTINA,DIARIO(REGULAR),JUTIAPA
22-01-2475-43,22-037,JUTIAPA,JUTIAPA,COLEGIO PARTICULAR MIXTO  GENESIS,7A. CALLE Y 8A. AVENIDA 7-49 ZONA 3 BARRIO EL CHAPARRON,52906524,SANDRA NINNETH BONILLA ARCHILA,SANDRA DAMIRA LÓPEZ RAMÍREZ,PRIMARIA,PRIVADO,URBANA,ABIERTA,MONOLINGUE,MATUTINA,DIARIO(REGULAR),JUTIAPA
22-01-2477-43,22-01-1223,JUTIAPA,JUTIAPA,EORM,CASERIO VISTA HERMOSA CANTON AMAYO INGENIO,51917005,EDGAR ARNULFO GONZÁLEZ GUDIEL,DANY JOSUÉ LÓPEZ ASENCIO,PRIMARIA,OFICIAL,RURAL,ABIERTA,MONOLINGUE,MATUTINA,DIARIO(REGULAR),JUTIAPA
22-01-2478-43,22-01-1223,JUTIAPA,JUTIAPA,EORM,CASERIO PASO BUENO CANTON VALENCIA,50328023,EDGAR ARNULFO GONZÁLEZ GUDIEL,FABIOLA ANGELINA MEDRANO GONZÁLEZ,PRIMARIA,OFICIAL,RURAL,ABIERTA,MONOLINGUE,MATUTINA,DIARIO(REGULAR),JUTIAPA
22-01-2490-42,22-01-1224,JUTIAPA,JUTIAPA,COLEGIO PARTICULAR MIXTO 'EL PILAR',5A. CALLE 5-09 ZONA 1,78446397,ENMA ONDINA RIOS GONZALEZ DE CONTRERAS,CELESTE ANGELICA JUÁREZ MARTÍNEZ,PARVULOS,PRIVADO,URBANA,ABIERTA,MONOLINGUE,MATUTINA,DIARIO(REGULAR),JUTIAPA
22-01-2491-42,22-01-1225,JUTIAPA,JUTIAPA,LICEO CREZCO APRENDIENDO,7A. CALLE 5-35 ZONA 3,41017149,CECILIA ISABEL ALDECOA CASASOLA,DULCE XIMENA CHINCHILLA MANSILLA,PARVULOS,PRIVADO,URBANA,ABIERTA,MONOLINGUE,MATUTINA,DIARIO(REGULAR),JUTIAPA
22-01-2492-43,22-01-1224,JUTIAPA,JUTIAPA,COLEGIO PARTICULAR MIXTO 'EL PILAR',5A. CALLE 5-09 ZONA 1,78446397,ENMA ONDINA RIOS GONZALEZ DE CONTRERAS,CELESTE ANGELICA JUÁREZ MARTÍNEZ,PRIMARIA,PRIVADO,URBANA,ABIERTA,MONOLINGUE,MATUTINA,DIARIO(REGULAR),JUTIAPA
22-01-2493-46,22-01-1221,JUTIAPA,JUTIAPA,COLEGIO EVANGELICO  VIDA NUEVA,COMPLEJO EDUCATIVO 0-16 ZONA 3 BARRIO EL CONDOR,32949057,SHAROL VANESA PÉREZ VEGA DE SOTO,ESLY OLIMPIA VEGA CANÚZ,DIVERSIFICADO,PRIVADO,URBANA,ABIERTA,MONOLINGUE,VESPERTINA,DIARIO(REGULAR),JUTIAPA
22-01-2494-45,22-001,JUTIAPA,JUTIAPA,COLEGIO INTEGRAL EVOLUCION  CIE,7A. CALLE Y 8A. AVENIDA 7-49 ZONA 3 BARRIO EL CHAPARRON,57313172,CECILIA ISABEL ALDECOA CASASOLA DE CASTRO,MIGUEL ANGEL MARTINEZ DE LA VEGA,BASICO,PRIVADO,URBANA,ABIERTA,MONOLINGUE,DOBLE,FIN DE SEMANA,JUTIAPA
22-01-2499-45,22-007,JUTIAPA,JUTIAPA,COLEGIO PARTICULAR MIXTO 'EL PILAR',5A. CALLE 5-09 ZONA 1,56756383,CARLOS OBDULIO OROZCO REYES,,BASICO,PRIVADO,URBANA,CERRADA TEMPORALMENTE,MONOLINGUE,VESPERTINA,DIARIO(REGULAR),JUTIAPA
22-01-2500-46,22-006,JUTIAPA,JUTIAPA,COLEGIO PARTICULAR MIXTO 'DAVENPORT-CIDETRA',ALDEA LAS TUNAS,78444200,RONY ESTUARDO SANDOVAL MEDINA,,DIVERSIFICADO,PRIVADO,RURAL,CERRADA TEMPORALMENTE,MONOLINGUE,MATUTINA,DIARIO(REGULAR),JUTIAPA
22-01-2521-42,22-005,JUTIAPA,JUTIAPA,EODP ANEXA A EORM,CASERIO LA FUENTE,,EDGAR ARNULFO GONZALEZ GUDIEL,,PARVULOS,OFICIAL,RURAL,CERRADA TEMPORALMENTE,MONOLINGUE,MATUTINA,DIARIO(REGULAR),JUTIAPA
22-01-2522-42,22-01-1220,JUTIAPA,JUTIAPA,EODP ANEXA A EORM,ALDEA EL PINAL,53292839,RONY ESTUARDO SANDOVAL MEDINA,ESCARLEN DANIELA CAMBARA DÍAZ,PARVULOS,OFICIAL,RURAL,ABIERTA,MONOLINGUE,MATUTINA,DIARIO(REGULAR),JUTIAPA
22-01-2523-42,22-01-1218,JUTIAPA,JUTIAPA,EODP ANEXA A EORM,ALDEA PIPILTEPEQUE,38146446,EMMANUEL MONZÓN HERRERA,OSCAR IVÁN LÉMUS MORALES,PARVULOS,OFICIAL,RURAL,ABIERTA,MONOLINGUE,MATUTINA,DIARIO(REGULAR),JUTIAPA
22-01-2525-42,22-01-1220,JUTIAPA,JUTIAPA,EODP ANEXA A EORM,CANTON SAN PABLO,58766871,RONY ESTUARDO SANDOVAL MEDINA,HENRY ESTUARDO MÉNDEZ OLIVARES,PARVULOS,OFICIAL,RURAL,ABIERTA,MONOLINGUE,MATUTINA,DIARIO(REGULAR),JUTIAPA
22-01-2527-46,22-001,JUTIAPA,JUTIAPA,COLEGIO INTEGRAL EVOLUCION  CIE,"7A. CALLE Y 8A. AVENIDA 7-49 ZONA 3, BARRIO EL CHAPARRON",57313172,CECILIA ISABEL ALDECOA CASASOLA DE CASTRO,MIGUEL ANGEL MARTINEZ DE LA VEGA,DIVERSIFICADO,PRIVADO,URBANA,ABIERTA,MONOLINGUE,DOBLE,FIN DE SEMANA,JUTIAPA
22-01-2541-45,22-01-1218,JUTIAPA,JUTIAPA,INEB DE TELESECUNDARIA,CANTON LAGUNILLA,46324916,EMMANUEL MONZÓN HERRERA,WENDY LILY TZOC ALEJANDRO,BASICO,OFICIAL,RURAL,ABIERTA,MONOLINGUE,MATUTINA,DIARIO(REGULAR),JUTIAPA
22-01-2542-45,22-01-1228,JUTIAPA,JUTIAPA,INEB DE TELESECUNDARIA,"CASERIO EL DURAZNO, CANTON VALENCIA",32261236,JULIO CÉSAR RIZO GARCÍA,OSMAN ARNOLDO SAENZ GOMEZ,BASICO,OFICIAL,RURAL,ABIERTA,MONOLINGUE,VESPERTINA,DIARIO(REGULAR),JUTIAPA
22-01-2551-42,22-01-1219,JUTIAPA,JUTIAPA,EODP ANEXA A EORM,CASERIO EL CUJE ALDEA BUENA VISTA,45979276,MARCO TULIO CASTILLO MELGAR,JANNETH XIOMARA ORDOÑEZ CRUZ,PARVULOS,OFICIAL,RURAL,ABIERTA,MONOLINGUE,MATUTINA,DIARIO(REGULAR),JUTIAPA
